{
 "schema": "rtm-project-1.0",
 "tool_version": "0.3.0",
 "saved_at": "2026-10-27T12:30:00+08:00",
 "saved_by": "E07",
 "assignment": {
  "schema": "rtm-assign-1.0",
  "tool_version": "0.3.0",
  "program": "L2MN-DEMO",
  "country": "MN",
  "round": 5,
  "enumerator_id": "E07",
  "generated_by": "L01",
  "generated_at": "2026-10-23T16:05:00+08:00",
  "rule": {
   "name": "keep_same",
   "rotation_share": 0.1,
   "hard_to_reach": "missed_with_full_cap_or_request",
   "fallback": "random",
   "seed": 20261027
  },
  "replacement_policy": {
   "active": true,
   "triggers": [
    "REFUSAL_HARD",
    "ALL_NUMBERS_DEAD"
   ]
  },
  "synthetic": true,
  "note": "SYNTHETIC sample for trying the tool. No real household, name or phone number.",
  "calendar": {
   "window_start": "2026-10-26",
   "window_end": "2026-11-20",
   "working_weekdays": [
    1,
    2,
    3,
    4,
    5,
    6
   ],
   "call_hours": {
    "start": 9,
    "end": 21
   },
   "time_zone": "Asia/Ulaanbaatar",
   "holidays": [
    {
     "date": "2026-11-10",
     "name": "Genghis Khan's Birthday",
     "estimated": false,
     "working": false
    }
   ],
   "dial_cap": 8
  },
  "households": [
   {
    "hhid": "0101-002",
    "psu": "0101",
    "stratum": "1",
    "contact": {
     "name": "Contact 0101-002 (synthetic)",
     "phones": [
      {
       "slot": 1,
       "number": "+000 01002 1712",
       "label": "respondent",
       "last_status": "NO_ANSWER"
      }
     ]
    },
    "history": {
     "joined_round": 1,
     "last_interview": {
      "round": 2,
      "date": "2026-07-29",
      "hour": 9
     },
     "last3": [
      true,
      false,
      false
     ],
     "last_enumerator": "E01"
    },
    "assignment": {
     "reason": "switch_hard_to_reach",
     "previous_enumerator": "E01"
    },
    "plan": {
     "first_dial_date": "2026-10-26",
     "target_hour": 9
    },
    "replacements": [
     {
      "hhid": "0101-102",
      "rank": 1,
      "contact": {
       "name": "Reserve 0101-102 (synthetic)",
       "phones": [
        {
         "slot": 1,
         "number": "+000 01102 1305",
         "label": "respondent"
        }
       ]
      }
     }
    ]
   },
   {
    "hhid": "0101-004",
    "psu": "0101",
    "stratum": "1",
    "contact": {
     "name": "Contact 0101-004 (synthetic)",
     "phones": [
      {
       "slot": 1,
       "number": "+000 01004 1128",
       "label": "respondent",
       "last_status": "NO_ANSWER"
      }
     ]
    },
    "history": {
     "joined_round": 1,
     "last3": [
      false,
      false,
      false
     ]
    },
    "assignment": {
     "reason": "keep"
    },
    "plan": {
     "first_dial_date": "2026-10-26",
     "target_hour": 10
    }
   },
   {
    "hhid": "0101-005",
    "psu": "0101",
    "stratum": "1",
    "contact": {
     "name": "Contact 0101-005 (synthetic)",
     "phones": [
      {
       "slot": 1,
       "number": "+000 01005 1530",
       "label": "respondent",
       "last_status": "COMPLETE"
      },
      {
       "slot": 2,
       "number": "+000 01005 2667",
       "label": "spouse"
      }
     ]
    },
    "history": {
     "joined_round": 1,
     "last_interview": {
      "round": 4,
      "date": "2026-09-28",
      "hour": 18
     },
     "last3": [
      false,
      false,
      true
     ],
     "last_enumerator": "E03"
    },
    "assignment": {
     "reason": "enumerator_unavailable",
     "previous_enumerator": "E03"
    },
    "plan": {
     "first_dial_date": "2026-10-29",
     "target_hour": 18
    }
   },
   {
    "hhid": "0101-008",
    "psu": "0101",
    "stratum": "1",
    "contact": {
     "name": "Contact 0101-008 (synthetic)",
     "phones": [
      {
       "slot": 1,
       "number": "+000 01008 1822",
       "label": "respondent",
       "last_status": "COMPLETE"
      },
      {
       "slot": 2,
       "number": "+000 01008 2312",
       "label": "spouse"
      }
     ]
    },
    "history": {
     "joined_round": 1,
     "last_interview": {
      "round": 4,
      "date": "2026-10-05",
      "hour": 18
     },
     "last3": [
      true,
      false,
      true
     ],
     "last_enumerator": "E07"
    },
    "assignment": {
     "reason": "keep"
    },
    "plan": {
     "first_dial_date": "2026-10-30",
     "target_hour": 18
    }
   },
   {
    "hhid": "0102-001",
    "psu": "0102",
    "stratum": "1",
    "contact": {
     "name": "Contact 0102-001 (synthetic)",
     "phones": [
      {
       "slot": 1,
       "number": "+000 02001 1517",
       "label": "respondent",
       "last_status": "COMPLETE"
      },
      {
       "slot": 2,
       "number": "+000 02001 2232",
       "label": "spouse"
      }
     ]
    },
    "history": {
     "joined_round": 1,
     "last_interview": {
      "round": 4,
      "date": "2026-10-06",
      "hour": 12
     },
     "last3": [
      true,
      true,
      true
     ],
     "last_enumerator": "E07"
    },
    "assignment": {
     "reason": "keep"
    },
    "plan": {
     "first_dial_date": "2026-10-30",
     "target_hour": 12
    },
    "replacements": [
     {
      "hhid": "0102-101",
      "rank": 1,
      "contact": {
       "name": "Reserve 0102-101 (synthetic)",
       "phones": [
        {
         "slot": 1,
         "number": "+000 02101 1681",
         "label": "respondent"
        }
       ]
      }
     }
    ]
   },
   {
    "hhid": "0102-006",
    "psu": "0102",
    "stratum": "1",
    "contact": {
     "name": "Contact 0102-006 (synthetic)",
     "phones": [
      {
       "slot": 1,
       "number": "+000 02006 1376",
       "label": "respondent",
       "last_status": "COMPLETE"
      },
      {
       "slot": 2,
       "number": "+000 02006 2185",
       "label": "spouse"
      }
     ]
    },
    "history": {
     "joined_round": 1,
     "last_interview": {
      "round": 4,
      "date": "2026-10-06",
      "hour": 17
     },
     "last3": [
      true,
      true,
      true
     ],
     "last_enumerator": "E07"
    },
    "assignment": {
     "reason": "keep"
    },
    "plan": {
     "first_dial_date": "2026-10-30",
     "target_hour": 17
    }
   },
   {
    "hhid": "0103-001",
    "psu": "0103",
    "stratum": "1",
    "contact": {
     "name": "Contact 0103-001 (synthetic)",
     "phones": [
      {
       "slot": 1,
       "number": "+000 03001 1493",
       "label": "respondent",
       "last_status": "COMPLETE"
      },
      {
       "slot": 2,
       "number": "+000 03001 2751",
       "label": "spouse"
      }
     ]
    },
    "history": {
     "joined_round": 1,
     "last_interview": {
      "round": 4,
      "date": "2026-10-06",
      "hour": 18
     },
     "last3": [
      true,
      true,
      true
     ],
     "last_enumerator": "E07"
    },
    "assignment": {
     "reason": "keep"
    },
    "plan": {
     "first_dial_date": "2026-10-30",
     "target_hour": 18
    },
    "replacements": [
     {
      "hhid": "0103-101",
      "rank": 1,
      "contact": {
       "name": "Reserve 0103-101 (synthetic)",
       "phones": [
        {
         "slot": 1,
         "number": "+000 03101 1124",
         "label": "respondent"
        }
       ]
      }
     }
    ]
   },
   {
    "hhid": "0103-002",
    "psu": "0103",
    "stratum": "1",
    "contact": {
     "name": "Contact 0103-002 (synthetic)",
     "phones": [
      {
       "slot": 1,
       "number": "+000 03002 1900",
       "label": "respondent",
       "last_status": "COMPLETE"
      },
      {
       "slot": 2,
       "number": "+000 03002 2462",
       "label": "spouse"
      }
     ]
    },
    "history": {
     "joined_round": 1,
     "last_interview": {
      "round": 4,
      "date": "2026-10-05",
      "hour": 16
     },
     "last3": [
      true,
      true,
      true
     ],
     "last_enumerator": "E07"
    },
    "assignment": {
     "reason": "keep"
    },
    "plan": {
     "first_dial_date": "2026-10-31",
     "target_hour": 16
    },
    "replacements": [
     {
      "hhid": "0103-102",
      "rank": 1,
      "contact": {
       "name": "Reserve 0103-102 (synthetic)",
       "phones": [
        {
         "slot": 1,
         "number": "+000 03102 1584",
         "label": "respondent"
        }
       ]
      }
     }
    ]
   },
   {
    "hhid": "0104-001",
    "psu": "0104",
    "stratum": "1",
    "contact": {
     "name": "Contact 0104-001 (synthetic)",
     "phones": [
      {
       "slot": 1,
       "number": "+000 04001 1835",
       "label": "respondent",
       "last_status": "NO_ANSWER"
      },
      {
       "slot": 2,
       "number": "+000 04001 2230",
       "label": "spouse"
      }
     ]
    },
    "history": {
     "joined_round": 1,
     "last_interview": {
      "round": 1,
      "date": "2026-07-04",
      "hour": 11
     },
     "last3": [
      false,
      false,
      false
     ],
     "last_enumerator": "E02"
    },
    "assignment": {
     "reason": "switch_hard_to_reach",
     "previous_enumerator": "E02"
    },
    "plan": {
     "first_dial_date": "2026-10-26",
     "target_hour": 11
    },
    "replacements": [
     {
      "hhid": "0104-101",
      "rank": 1,
      "contact": {
       "name": "Reserve 0104-101 (synthetic)",
       "phones": [
        {
         "slot": 1,
         "number": "+000 04101 1457",
         "label": "respondent"
        }
       ]
      }
     }
    ]
   },
   {
    "hhid": "0104-004",
    "psu": "0104",
    "stratum": "1",
    "contact": {
     "name": "Contact 0104-004 (synthetic)",
     "phones": [
      {
       "slot": 1,
       "number": "+000 04004 1330",
       "label": "respondent",
       "last_status": "COMPLETE"
      },
      {
       "slot": 2,
       "number": "+000 04004 2579",
       "label": "spouse"
      }
     ]
    },
    "history": {
     "joined_round": 1,
     "last_interview": {
      "round": 4,
      "date": "2026-10-06",
      "hour": 20
     },
     "last3": [
      true,
      true,
      true
     ],
     "last_enumerator": "E03"
    },
    "assignment": {